"","concept_id","concept_name","domain_id","concept_class_id","vocabulary_id"
"507",4095764,"Malignant neoplasm of connective tissue of orbit","condition","clinical finding","SNOMED"
"508",4092529,"Malignant neoplasm of extraocular muscle of orbit","condition","clinical finding","SNOMED"
"509",4092530,"Malignant tumor of lacrimal gland","condition","clinical finding","SNOMED"
"510",4092531,"Malignant neoplasm of lacrimal sac","condition","clinical finding","SNOMED"
"511",372569,"Malignant neoplasm of nasolacrimal duct","condition","clinical finding","SNOMED"
"512",4091490,"Malignant neoplasm of cerebrum (excluding lobes and ventricles)","condition","clinical finding","SNOMED"
"513",4091491,"Malignant neoplasm of basal ganglia","condition","clinical finding","SNOMED"
"514",4092532,"Malignant neoplasm of cerebral cortex","condition","clinical finding","SNOMED"
"515",4091492,"Malignant neoplasm of corpus striatum","condition","clinical finding","SNOMED"
"516",4095298,"Malignant neoplasm of globus pallidus","condition","clinical finding","SNOMED"
"517",4091493,"Malignant tumor of hypothalamus","condition","clinical finding","SNOMED"
"518",4091610,"Malignant neoplasm of thalamus","condition","clinical finding","SNOMED"
"519",4094251,"Malignant neoplasm of hippocampus","condition","clinical finding","SNOMED"
"520",4094252,"Malignant neoplasm of uncus","condition","clinical finding","SNOMED"
"521",4094254,"Malignant tumor of choroid plexus","condition","clinical finding","SNOMED"
"522",4091612,"Malignant neoplasm of floor of cerebral ventricle","condition","clinical finding","SNOMED"
"523",4095887,"Malignant neoplasm of cerebral peduncle","condition","clinical finding","SNOMED"
"524",4091614,"Malignant neoplasm of medulla oblongata","condition","clinical finding","SNOMED"
"525",4095888,"Malignant neoplasm of midbrain","condition","clinical finding","SNOMED"
"526",4095299,"Malignant neoplasm of pons","condition","clinical finding","SNOMED"
"527",4095889,"Malignant neoplasm of corpus callosum","condition","clinical finding","SNOMED"
"528",4095300,"Malignant neoplasm of tapetum","condition","clinical finding","SNOMED"
"529",4095303,"Malignant neoplasm of olfactory bulb","condition","clinical finding","SNOMED"
"530",4091616,"Malignant neoplasm of cerebral dura mater","condition","clinical finding","SNOMED"
"531",4091617,"Malignant neoplasm of cerebral arachnoid mater","condition","clinical finding","SNOMED"
"532",4091618,"Malignant neoplasm of cerebral pia mater","condition","clinical finding","SNOMED"
"533",4095892,"Malignant neoplasm of peripheral nerves of head, face and neck","condition","clinical finding","SNOMED"
"534",4095304,"Malignant neoplasm of pituitary gland and craniopharyngeal duct","condition","clinical finding","SNOMED"
"535",4095305,"Malignant tumor of craniopharyngeal duct","condition","clinical finding","SNOMED"
"536",438106,"Reticulosarcoma of lymph nodes of head, face and neck","condition","clinical finding","SNOMED"
"537",438380,"Lymphosarcoma of lymph nodes of head, face and neck","condition","clinical finding","SNOMED"
"538",436927,"Hodgkin's disease, lymphocytic-histiocytic predominance of lymph nodes of head, face and neck","condition","clinical finding","SNOMED"
"539",435198,"Hodgkin's disease, nodular sclerosis of lymph nodes of head, face and neck","condition","clinical finding","SNOMED"
"540",440056,"Hodgkin's disease, mixed cellularity of lymph nodes of head, face and neck","condition","clinical finding","SNOMED"
"541",439286,"Hodgkin's disease, lymphocytic depletion of lymph nodes of head, face and neck","condition","clinical finding","SNOMED"
"542",435207,"Nodular lymphoma of lymph nodes of head, face and neck","condition","clinical finding","SNOMED"
"543",132570,"Leukemic reticuloendotheliosis of lymph nodes of head, face and neck","condition","clinical finding","SNOMED"
"544",4094540,"Mast cell malignancy of lymph nodes of head, face and neck","condition","clinical finding","SNOMED"
"545",765459,"Metastatic neoplasm of left basal ganglion","condition","clinical finding","SNOMED"
"546",4338758,"Malignant tumor of eyelid","condition","clinical finding","SNOMED"
"547",4338759,"Squamous cell carcinoma of eyelid","condition","clinical finding","SNOMED"
"548",4335883,"Basal cell carcinoma of eyelid","condition","clinical finding","SNOMED"
"549",4335884,"Sebaceous adenocarcinoma of eyelid","condition","clinical finding","SNOMED"
"550",4338760,"Malignant melanoma of eyelid","condition","clinical finding","SNOMED"
"551",4334094,"Kaposi's sarcoma of eyelid","condition","clinical finding","SNOMED"
"552",4334256,"Lymphoma of retina","condition","clinical finding","SNOMED"
"553",37018884,"Malignant glioma of eye","condition","clinical finding","SNOMED"
"554",4112589,"Malignant tumor of nasal skeleton","condition","clinical finding","SNOMED"
"555",4110434,"Malignant tumor of inferior turbinate","condition","clinical finding","SNOMED"
"556",4112593,"Malignant tumor of middle turbinate","condition","clinical finding","SNOMED"
"557",4110435,"Malignant tumor of posterior margin of nasal septum and choanae","condition","clinical finding","SNOMED"
"558",4110559,"Malignant tumor of anterior commissure","condition","clinical finding","SNOMED"
"559",4110562,"Malignant tumor of posterior commissure","condition","clinical finding","SNOMED"
"560",4110565,"Malignant tumor of suprahyoid epiglottis","condition","clinical finding","SNOMED"
"561",4110566,"Malignant tumor of infrahyoid epiglottis","condition","clinical finding","SNOMED"
"562",4110567,"Malignant tumor of laryngeal ventricle","condition","clinical finding","SNOMED"
"563",4111797,"Malignant tumor of parapharyngeal space","condition","clinical finding","SNOMED"
"564",4111799,"Carcinoma of cervical part of esophagus","condition","clinical finding","SNOMED"
"565",4110884,"Astrocytoma of brain","condition","clinical finding","SNOMED"
"566",4112961,"Oligodendroglioma of brain","condition","clinical finding","SNOMED"
"567",4114193,"Pituitary carcinoma","condition","clinical finding","SNOMED"
"568",4114198,"Malignant tumor of olfactory tract","condition","clinical finding","SNOMED"
"569",4116215,"Malignant tumor of optic nerve and sheath","condition","clinical finding","SNOMED"
"570",4114199,"Malignant tumor of optic nerve sheath","condition","clinical finding","SNOMED"
"571",4112969,"Malignant meningioma of optic nerve sheath","condition","clinical finding","SNOMED"
"572",4110889,"Malignant tumor of acoustic vestibular nerve","condition","clinical finding","SNOMED"
"573",4114201,"Adenoid cystic carcinoma of lacrimal gland","condition","clinical finding","SNOMED"
"574",4112975,"Adenocarcinoma of lacrimal gland","condition","clinical finding","SNOMED"
"575",4116218,"Carcinoma ex pleomorphic adenoma of lacrimal gland","condition","clinical finding","SNOMED"
"576",4116219,"Liposarcoma of orbit","condition","clinical finding","SNOMED"
"577",4110891,"Rhabdomyosarcoma of orbit","condition","clinical finding","SNOMED"
"578",4112979,"Malignant hemangiopericytoma of orbit","condition","clinical finding","SNOMED"
"579",4116220,"Malignant fibrous histiocytoma of orbit","condition","clinical finding","SNOMED"
"580",4111002,"Squamous cell carcinoma of conjunctiva","condition","clinical finding","SNOMED"
"581",4112982,"Malignant melanoma of conjunctiva","condition","clinical finding","SNOMED"
"582",4114213,"Squamous cell carcinoma of cornea","condition","clinical finding","SNOMED"
"583",4111005,"Malignant melanoma of iris","condition","clinical finding","SNOMED"
"584",4112983,"Malignant melanoma of ciliary body","condition","clinical finding","SNOMED"
"585",4112984,"Adenocarcinoma of pigmented epithelium of ciliary body","condition","clinical finding","SNOMED"
"586",4114215,"Adenocarcinoma of non-pigmented epithelium of ciliary body","condition","clinical finding","SNOMED"
"587",4116224,"Malignant melanoma of choroid","condition","clinical finding","SNOMED"
"588",4116236,"Malignant tumor of ear, nose and throat","condition","clinical finding","SNOMED"
"589",4111022,"Malignant tumor of lateral nasal wall","condition","clinical finding","SNOMED"
"590",4111029,"Malignant tumor of pituitary and hypothalamus","condition","clinical finding","SNOMED"
"591",4114340,"Kaposi's sarcoma of conjunctiva","condition","clinical finding","SNOMED"
"592",4111030,"Kaposi's sarcoma of cornea","condition","clinical finding","SNOMED"
"593",4116348,"Metastasis to nervous system and eye","condition","clinical finding","SNOMED"
"594",4149839,"Malignant tumor of middle ear and mastoid","condition","clinical finding","SNOMED"
"595",4149850,"Malignant melanoma of head and neck","condition","clinical finding","SNOMED"
"596",4170619,"Malignant melanoma of eye","condition","clinical finding","SNOMED"
"597",4174443,"Malignant glioma of brain","condition","clinical finding","SNOMED"
"598",4174444,"Glioblastoma multiforme of brain","condition","clinical finding","SNOMED"
"599",4174769,"Primary cerebral lymphoma","condition","clinical finding","SNOMED"
"600",4172359,"Carcinoma of larynx","condition","clinical finding","SNOMED"
"601",4082011,"Malignant tumor of external ear","condition","clinical finding","SNOMED"
"602",4079553,"Anaplastic astrocytoma of brain","condition","clinical finding","SNOMED"
"603",4079153,"Medulloblastoma of cerebellum","condition","clinical finding","SNOMED"
"604",4080741,"Malignant lymphoma of thyroid gland","condition","clinical finding","SNOMED"
"605",4094020,"Malignant tumor of lacrimal drainage structure","condition","clinical finding","SNOMED"
"606",4083496,"Neuroblastoma of brain","condition","clinical finding","SNOMED"
"607",4111221,"Squamous cell carcinoma of skin of cheek","condition","clinical finding","SNOMED"
"608",4112780,"Metastasis to brain of unknown primary","condition","clinical finding","SNOMED"
"609",4110135,"Metastasis to eye of unknown primary","condition","clinical finding","SNOMED"
"610",4113636,"Carcinoma of skin of head/neck","condition","clinical finding","SNOMED"
"611",4123439,"Metastasis to head and neck lymph node","condition","clinical finding","SNOMED"
"612",4151310,"Malignant neoplasm of canthus","condition","clinical finding","SNOMED"
"613",4196112,"Retinal pigment epithelial adenocarcinoma","condition","clinical finding","SNOMED"
"614",4197474,"Malignant neoplasm of upper eyelid","condition","clinical finding","SNOMED"
"615",4197475,"Malignant neoplasm of lower eyelid","condition","clinical finding","SNOMED"
"616",4199641,"Leukemic infiltrate of choroid","condition","clinical finding","SNOMED"
"617",4197152,"Leukemic infiltrate of retina","condition","clinical finding","SNOMED"
"618",4178957,"Malignant tumor of middle ear","condition","clinical finding","SNOMED"
"619",4181340,"Malignant tumor of branchial cleft","condition","clinical finding","SNOMED"
"620",4177108,"Malignant tumor of nasal septum","condition","clinical finding","SNOMED"
"621",4181346,"Malignant tumor of mastoid air cells","condition","clinical finding","SNOMED"
"622",4177109,"Malignant tumor of ethmoid sinus","condition","clinical finding","SNOMED"
"623",4181348,"Malignant tumor of frontal sinus","condition","clinical finding","SNOMED"
"624",4177110,"Malignant tumor of sphenoid sinus","condition","clinical finding","SNOMED"
"625",4177111,"Malignant tumor of subglottis","condition","clinical finding","SNOMED"
"626",4181349,"Malignant tumor of laryngeal cartilage","condition","clinical finding","SNOMED"
"627",4181350,"Malignant tumor of soft tissue of head","condition","clinical finding","SNOMED"
"628",4180902,"Malignant tumor of soft tissue of face","condition","clinical finding","SNOMED"
"629",4181477,"Malignant neoplasm of eye","condition","clinical finding","SNOMED"
"630",4180906,"Malignant tumor of orbit","condition","clinical finding","SNOMED"
"631",4177231,"Malignant tumor of conjunctiva","condition","clinical finding","SNOMED"
"632",4181478,"Malignant tumor of cornea","condition","clinical finding","SNOMED"
"633",4178973,"Malignant tumor of retina","condition","clinical finding","SNOMED"
"634",4181479,"Malignant tumor of choroid","condition","clinical finding","SNOMED"
"635",4181480,"Malignant neoplasm of frontal lobe","condition","clinical finding","SNOMED"
"636",4180907,"Malignant neoplasm of temporal lobe","condition","clinical finding","SNOMED"
"637",4181481,"Malignant neoplasm of parietal lobe","condition","clinical finding","SNOMED"
"638",4177232,"Malignant neoplasm of occipital lobe","condition","clinical finding","SNOMED"
"639",4177233,"Malignant neoplasm of cerebral ventricles","condition","clinical finding","SNOMED"
"640",4180908,"Malignant neoplasm of brainstem","condition","clinical finding","SNOMED"
"641",4178974,"Malignant neoplasm of cerebral meninges","condition","clinical finding","SNOMED"
"642",4177235,"Malignant tumor of pituitary gland","condition","clinical finding","SNOMED"
"643",4178977,"Malignant tumor of pineal gland","condition","clinical finding","SNOMED"
"644",4180910,"Malignant tumor of vocal cord","condition","clinical finding","SNOMED"
"645",4178978,"Malignant tumor of aryepiglottic fold - laryngeal aspect","condition","clinical finding","SNOMED"
"646",4177237,"Malignant tumor of false cord","condition","clinical finding","SNOMED"
"647",4179095,"Malignant tumor of face","condition","clinical finding","SNOMED"
"648",4158977,"Retinoblastoma","condition","clinical finding","SNOMED"
"649",441224,"Primary malignant neoplasm of cervical esophagus","condition","clinical finding","SNOMED"
"650",374874,"Primary malignant neoplasm of eye","condition","clinical finding","SNOMED"
"651",4155169,"Primary malignant neoplasm of false vocal cord","condition","clinical finding","SNOMED"
"652",372567,"Primary malignant neoplasm of lacrimal gland","condition","clinical finding","SNOMED"
"653",4155170,"Primary malignant neoplasm of laryngeal aspect of aryepiglottic fold","condition","clinical finding","SNOMED"
"654",26052,"Primary malignant neoplasm of larynx","condition","clinical finding","SNOMED"
"655",4162122,"Primary malignant neoplasm of vocal cord","condition","clinical finding","SNOMED"
"656",4157451,"Carcinoma of glottis","condition","clinical finding","SNOMED"
"657",4157452,"Carcinoma of subglottis","condition","clinical finding","SNOMED"
"658",4162136,"Carcinoma of supraglottis","condition","clinical finding","SNOMED"
"659",4162251,"Malignant neoplasm of skin head and neck","condition","clinical finding","SNOMED"
"660",4157456,"Primary malignant neoplasm of skin head and neck","condition","clinical finding","SNOMED"
"661",4162999,"Carcinoma of vocal cord","condition","clinical finding","SNOMED"
"662",4164614,"Ring melanoma of ciliary body","condition","clinical finding","SNOMED"
"663",4221229,"Basal cell carcinoma of postauricular skin","condition","clinical finding","SNOMED"
"664",4221232,"Basal cell carcinoma of preauricular skin","condition","clinical finding","SNOMED"
"665",4220171,"Basal cell carcinoma of earlobe","condition","clinical finding","SNOMED"
"666",4220181,"Basal cell carcinoma of pinnal sulcus","condition","clinical finding","SNOMED"
"667",4220475,"Basal cell carcinoma of antihelix of ear","condition","clinical finding","SNOMED"
"668",4291143,"Basal cell carcinoma of lower eyelid","condition","clinical finding","SNOMED"
"669",4292378,"Basal cell carcinoma of medial canthus","condition","clinical finding","SNOMED"
"670",4291144,"Basal cell carcinoma of lateral canthus","condition","clinical finding","SNOMED"
"671",4224745,"Basal cell carcinoma of root of nose","condition","clinical finding","SNOMED"
"672",4221981,"Basal cell carcinoma of dorsum of nose","condition","clinical finding","SNOMED"
"673",4223496,"Basal cell carcinoma of lateral side wall of nose","condition","clinical finding","SNOMED"
"674",4222265,"Basal cell carcinoma of ala nasi","condition","clinical finding","SNOMED"
"675",4222266,"Basal cell carcinoma of supratip of nose","condition","clinical finding","SNOMED"
"676",4221984,"Basal cell carcinoma of tip of nose","condition","clinical finding","SNOMED"
"677",4292379,"Basal cell carcinoma of nasal columella","condition","clinical finding","SNOMED"
"678",4292380,"Basal cell carcinoma of nasolabial groove","condition","clinical finding","SNOMED"
"679",4292381,"Basal cell carcinoma of cheek","condition","clinical finding","SNOMED"
"680",4297665,"Basal cell carcinoma of chin","condition","clinical finding","SNOMED"
"681",4297666,"Basal cell carcinoma of neck","condition","clinical finding","SNOMED"
"682",4222268,"Basal cell carcinoma of helix of ear","condition","clinical finding","SNOMED"
"683",4222107,"Basal cell carcinoma of conchal bowl of ear","condition","clinical finding","SNOMED"
"684",4222108,"Basal cell carcinoma of antitragus","condition","clinical finding","SNOMED"
"685",4222109,"Basal cell carcinoma of tragus","condition","clinical finding","SNOMED"
"686",4222110,"Basal cell carcinoma of obverse of pinna","condition","clinical finding","SNOMED"
"687",4299417,"Basal cell carcinoma of face","condition","clinical finding","SNOMED"
"688",4291454,"Basal cell carcinoma of nose","condition","clinical finding","SNOMED"
"689",4294416,"Basal cell carcinoma of ear","condition","clinical finding","SNOMED"
"690",4300555,"Squamous cell carcinoma of scalp","condition","clinical finding","SNOMED"
"691",4298026,"Squamous cell carcinoma of skin of face","condition","clinical finding","SNOMED"
"692",4300556,"Squamous cell carcinoma of forehead","condition","clinical finding","SNOMED"
"693",4295624,"Squamous cell carcinoma of skin of ear","condition","clinical finding","SNOMED"
"694",4298032,"Basal cell carcinoma of scalp","condition","clinical finding","SNOMED"
"695",4298033,"Basal cell carcinoma of forehead","condition","clinical finding","SNOMED"
"696",4300565,"Basal cell carcinoma of temple","condition","clinical finding","SNOMED"
"697",4297184,"Basal cell carcinoma of glabella","condition","clinical finding","SNOMED"
"698",4297185,"Basal cell carcinoma of upper eyelid","condition","clinical finding","SNOMED"
"699",4298129,"Moll's gland adenocarcinoma","condition","clinical finding","SNOMED"
"700",4300574,"Ceruminous gland adenocarcinoma","condition","clinical finding","SNOMED"
"701",4237016,"Squamous cell carcinoma of larynx","condition","clinical finding","SNOMED"
"702",4252536,"Squamous cell carcinoma of epiglottis","condition","clinical finding","SNOMED"
"703",4189478,"Metastatic neuroblastoma of orbit proper","condition","clinical finding","SNOMED"
"704",4189506,"Mucosa-associated lymphoid tissue (MALT) lymphoma of orbit","condition","clinical finding","SNOMED"
"705",4216273,"Primary malignant neoplasm of ear, nose AND/OR throat","condition","clinical finding","SNOMED"
"706",4218170,"Malignant medulloepithelioma of ciliary body","condition","clinical finding","SNOMED"
"707",4226624,"Malignant lymphoma of the eye region","condition","clinical finding","SNOMED"
"708",4227209,"Primary intraocular non-Hodgkin malignant lymphoma","condition","clinical finding","SNOMED"
"709",4227969,"Primary lymphoma of brain associated with AIDS","condition","clinical finding","SNOMED"
"710",4306331,"Squamous cell carcinoma of bridge of nose","condition","clinical finding","SNOMED"
"711",4307574,"Squamous cell carcinoma of chin","condition","clinical finding","SNOMED"
"712",4307708,"Squamous cell carcinoma of ala nasi","condition","clinical finding","SNOMED"
"713",4309385,"Carcinoma of nasal meatus","condition","clinical finding","SNOMED"
"714",4312004,"Primary malignant neoplasm of lacrimal gland duct","condition","clinical finding","SNOMED"
"715",4307000,"Leukemic infiltration of orbit","condition","clinical finding","SNOMED"
"716",4313056,"Primary malignant neoplasm of lacrimal drainage system","condition","clinical finding","SNOMED"
"717",4313171,"Malignant melanoma of skin of canthus of eye","condition","clinical finding","SNOMED"
"718",4308621,"Squamous cell carcinoma of skin of neck","condition","clinical finding","SNOMED"
"719",4308629,"Basal cell carcinoma of external auditory canal","condition","clinical finding","SNOMED"
"720",4307407,"Carcinoma of tip of nose","condition","clinical finding","SNOMED"
"721",4310566,"Malignant neoplasm of skin of eyelid","condition","clinical finding","SNOMED"
"722",4309539,"Malignant melanoma of skin of lower eyelid","condition","clinical finding","SNOMED"
"723",4313205,"Malignant melanoma of skin of upper eyelid","condition","clinical finding","SNOMED"
"724",4307861,"Squamous cell carcinoma of external auditory canal","condition","clinical finding","SNOMED"
"725",4313766,"Malignant melanoma of retina","condition","clinical finding","SNOMED"
"726",4308005,"Squamous cell carcinoma of auricle of ear","condition","clinical finding","SNOMED"
"727",4309707,"Sarcoma of head and neck","condition","clinical finding","SNOMED"
"728",4312370,"Squamous cell carcinoma of tip of nose","condition","clinical finding","SNOMED"
"729",4314458,"Anaplastic glioma of brain","condition","clinical finding","SNOMED"
"730",4314584,"Squamous cell carcinoma of nasolabial fold","condition","clinical finding","SNOMED"
"731",4308934,"Malignant glioma of brainstem","condition","clinical finding","SNOMED"
"732",4313482,"Basal cell carcinoma of auricle of ear","condition","clinical finding","SNOMED"
"733",4314299,"Squamous cell carcinoma of temple","condition","clinical finding","SNOMED"
"734",4143679,"Hodgkin's disease, lymphocytic depletion of lymph nodes of head","condition","clinical finding","SNOMED"
"735",443588,"Malignant neoplasm of brain","condition","clinical finding","SNOMED"
"736",443561,"Malignant neoplasm of cerebrum","condition","clinical finding","SNOMED"
"737",762782,"Gnathic osteosarcoma","condition","clinical finding","SNOMED"
"738",4258703,"Primary squamous cell carcinoma of naris","condition","clinical finding","SNOMED"
"739",40479582,"Adenocarcinoma of head and neck","condition","clinical finding","SNOMED"
"740",40480128,"Malignant neoplasm of skin of face","condition","clinical finding","SNOMED"
"741",40482750,"Malignant neoplasm of ear","condition","clinical finding","SNOMED"
"742",40490343,"Chordoma of clivus","condition","clinical finding","SNOMED"
"743",40486083,"Leiomyosarcoma of scalp","condition","clinical finding","SNOMED"
"744",40486535,"Angiosarcoma of cheek","condition","clinical finding","SNOMED"
"745",40487047,"Malignant neoplasm of carotid body","condition","clinical finding","SNOMED"
"746",40487484,"Carcinoma of cheek","condition","clinical finding","SNOMED"
"747",40488902,"Malignant neoplasm of cerebellopontine angle","condition","clinical finding","SNOMED"
"748",40488917,"Follicular non-Hodgkin's lymphoma of nose","condition","clinical finding","SNOMED"
"749",40488935,"Malignant neoplasm of axial suprasellar region of brain","condition","clinical finding","SNOMED"
"750",40488937,"Malignant teratoma of pineal region","condition","clinical finding","SNOMED"
"751",40488991,"Malignant neoplasm of mastoid","condition","clinical finding","SNOMED"
"752",40489481,"Non-Hodgkin's lymphoma of nose","condition","clinical finding","SNOMED"
"753",40490009,"Transglottic malignant neoplasm of larynx","condition","clinical finding","SNOMED"
"754",40490463,"Malignant neoplasm of maxillofacial bone","condition","clinical finding","SNOMED"
"755",40490993,"Malignant neoplasm of mandible","condition","clinical finding","SNOMED"
"756",40490994,"Malignant neoplasm of soft tissue of orbit","condition","clinical finding","SNOMED"
"757",40492016,"Carcinoma of pineal gland","condition","clinical finding","SNOMED"
"758",40492482,"Squamous cell carcinoma of nose","condition","clinical finding","SNOMED"
"759",40492932,"Carcinoma of nose","condition","clinical finding","SNOMED"
"760",40492933,"Carcinoma of brain","condition","clinical finding","SNOMED"
"761",40492934,"Carcinoma of nasal cavity","condition","clinical finding","SNOMED"
"762",40493019,"Diffuse non-Hodgkin's lymphoma of nose","condition","clinical finding","SNOMED"
"763",40493020,"Malignant neoplasm of upper respiratory tract","condition","clinical finding","SNOMED"
"764",40493032,"Carcinoma of maxilla","condition","clinical finding","SNOMED"
"765",40486161,"Carcinoma of face","condition","clinical finding","SNOMED"
"766",40486207,"Carcinoma of hypothalamus","condition","clinical finding","SNOMED"
"767",40486222,"Sarcoma of mandible","condition","clinical finding","SNOMED"
"768",40486640,"Sarcoma of skull","condition","clinical finding","SNOMED"
"769",40487140,"Carcinoma of nasal septum","condition","clinical finding","SNOMED"
"770",40487143,"Malignant neoplasm of cerebellum","condition","clinical finding","SNOMED"
"771",40487596,"Carcinoma of mandible","condition","clinical finding","SNOMED"
"772",133511,"Lethal midline granuloma","condition","clinical finding","SNOMED"
"773",37016571,"Basal cell carcinoma of naris","condition","clinical finding","SNOMED"
"774",36684443,"Grade 2 astrocytoma of brain","condition","clinical finding","SNOMED"
"775",36717624,"Primary glioblastoma multiforme of frontal lobe","condition","clinical finding","SNOMED"
"776",36685010,"Sarcoma of face","condition","clinical finding","SNOMED"
"777",44783808,"Undifferentiated carcinoma of nasal sinus","condition","clinical finding","SNOMED"
"778",44783845,"Malignant melanoma of nasal cavity","condition","clinical finding","SNOMED"
"779",44784245,"Malignant melanoma of ethmoid sinus","condition","clinical finding","SNOMED"
"780",44784247,"Malignant melanoma of maxillary sinus","condition","clinical finding","SNOMED"
"781",44782471,"Supratentorial primitive neuroectodermal tumor","condition","clinical finding","SNOMED"
"782",44783280,"Sarcoma of orbit","condition","clinical finding","SNOMED"
"783",44782480,"Leiomyosarcoma of orbit","condition","clinical finding","SNOMED"
"784",45768824,"Primary adenocarcinoma of accessory sinus","condition","clinical finding","SNOMED"
"785",45771012,"Primary adenocarcinoma of maxillary sinus","condition","clinical finding","SNOMED"
