"","concept_id","concept_name","domain_id","concept_class_id","vocabulary_id"
"248",4178965,"Malignant tumor of retromolar area","condition","clinical finding","SNOMED"
"249",4177102,"Malignant tumor of vallecula","condition","clinical finding","SNOMED"
"250",4180909,"Malignant tumor of minor salivary gland","condition","clinical finding","SNOMED"
"251",436042,"Primary malignant neoplasm of anterior two-thirds of tongue","condition","clinical finding","SNOMED"
"252",4162118,"Malignant neoplasm of border of tongue","condition","clinical finding","SNOMED"
"253",4156114,"Primary malignant neoplasm of border of tongue","condition","clinical finding","SNOMED"
"254",134579,"Primary malignant neoplasm of buccal mucosa","condition","clinical finding","SNOMED"
"255",255192,"Primary malignant neoplasm of commissure of lip","condition","clinical finding","SNOMED"
"256",140950,"Primary malignant neoplasm of gum","condition","clinical finding","SNOMED"
"257",4155171,"Primary malignant neoplasm of lip","condition","clinical finding","SNOMED"
"258",440335,"Primary malignant neoplasm of lower gum","condition","clinical finding","SNOMED"
"259",4162861,"Primary malignant neoplasm of minor salivary gland","condition","clinical finding","SNOMED"
"260",439404,"Primary malignant neoplasm of oral cavity","condition","clinical finding","SNOMED"
"261",434588,"Primary malignant neoplasm of parotid gland","condition","clinical finding","SNOMED"
"262",31509,"Primary malignant neoplasm of tonsil","condition","clinical finding","SNOMED"
"263",435478,"Primary malignant neoplasm of upper gum","condition","clinical finding","SNOMED"
"264",132565,"Primary malignant neoplasm of vermilion border of lower lip","condition","clinical finding","SNOMED"
"265",138074,"Primary malignant neoplasm of vermilion border of upper lip","condition","clinical finding","SNOMED"
"266",4222105,"Basal cell carcinoma of upper lip","condition","clinical finding","SNOMED"
"267",4222267,"Basal cell carcinoma of lower lip","condition","clinical finding","SNOMED"
"268",4298740,"Basal cell carcinoma of skin of lip","condition","clinical finding","SNOMED"
"269",4300554,"Verrucous carcinoma of oral cavity","condition","clinical finding","SNOMED"
"270",4297188,"Malignant melanoma of oral cavity","condition","clinical finding","SNOMED"
"271",4297349,"Metastasis involving oral cavity","condition","clinical finding","SNOMED"
"272",4256777,"Squamous cell carcinoma of pharynx","condition","clinical finding","SNOMED"
"273",4169288,"Squamous cell carcinoma of mucous membrane of lower lip","condition","clinical finding","SNOMED"
"274",4302482,"Squamous cell carcinoma of mucous membrane of upper lip","condition","clinical finding","SNOMED"
"275",4169627,"Squamous cell carcinoma of oral mucous membrane","condition","clinical finding","SNOMED"
"276",4306501,"Undifferentiated carcinoma of nasopharynx","condition","clinical finding","SNOMED"
"277",4309248,"Squamous cell carcinoma of nasopharynx","condition","clinical finding","SNOMED"
"278",4309400,"Adenoid cystic carcinoma of salivary gland","condition","clinical finding","SNOMED"
"279",4306965,"Olfactory neuroblastoma","condition","clinical finding","SNOMED"
"280",4312929,"Polymorphous low grade adenocarcinoma of salivary gland","condition","clinical finding","SNOMED"
"281",4307152,"Adenocarcinoma of nasopharynx","condition","clinical finding","SNOMED"
"282",4307266,"Adenoid cystic carcinoma of submandibular gland","condition","clinical finding","SNOMED"
"283",4308627,"Adenoid cystic carcinoma of oropharynx","condition","clinical finding","SNOMED"
"284",4310565,"Mucoepidermoid carcinoma of submandibular gland","condition","clinical finding","SNOMED"
"285",4309545,"Squamous cell carcinoma of oropharynx","condition","clinical finding","SNOMED"
"286",4313754,"Adenoid cystic carcinoma of parotid gland","condition","clinical finding","SNOMED"
"287",4311283,"Malignant neoplasm of gum and contiguous sites","condition","clinical finding","SNOMED"
"288",4311287,"Mucoepidermoid carcinoma of salivary gland","condition","clinical finding","SNOMED"
"289",4308149,"Mucoepidermoid carcinoma of parotid gland","condition","clinical finding","SNOMED"
"290",4310839,"Malignant melanoma of skin of lower lip","condition","clinical finding","SNOMED"
"291",4309088,"Malignant melanoma of skin of upper lip","condition","clinical finding","SNOMED"
"292",4311719,"Primary Kaposi's sarcoma of oral cavity","condition","clinical finding","SNOMED"
"293",4310135,"Primary sarcoma of tongue","condition","clinical finding","SNOMED"
"294",4312798,"Carcinoma ex pleomorphic adenoma of parotid gland","condition","clinical finding","SNOMED"
"295",4314314,"Malignant mixed tumor of salivary gland","condition","clinical finding","SNOMED"
"296",40489409,"Diffuse non-Hodgkin's lymphoma of nasopharynx","condition","clinical finding","SNOMED"
"297",40489467,"Non-Hodgkin's lymphoma of nasopharynx","condition","clinical finding","SNOMED"
"298",40489483,"Non-Hodgkin's lymphoma of oral cavity","condition","clinical finding","SNOMED"
"299",40489963,"Diffuse non-Hodgkin's lymphoma of oral cavity","condition","clinical finding","SNOMED"
"300",40493011,"Follicular non-Hodgkin's lymphoma of tonsil","condition","clinical finding","SNOMED"
"301",40493017,"Follicular non-Hodgkin's lymphoma of oral cavity","condition","clinical finding","SNOMED"
"302",40493495,"Carcinoma of floor of mouth","condition","clinical finding","SNOMED"
"303",40493514,"Diffuse non-Hodgkin's lymphoma of tonsil","condition","clinical finding","SNOMED"
"304",40486169,"Follicular non-Hodgkin's lymphoma of nasopharynx","condition","clinical finding","SNOMED"
"305",40486174,"Malignant neoplasm of alveolus of maxilla","condition","clinical finding","SNOMED"
"306",40486201,"Nasopharyngeal carcinoma","condition","clinical finding","SNOMED"
"307",40486208,"Carcinoma of pharynx","condition","clinical finding","SNOMED"
"308",40486214,"Malignant neoplasm of alveolus dentalis","condition","clinical finding","SNOMED"
"309",40486637,"Non-Hodgkin's lymphoma of tonsil","condition","clinical finding","SNOMED"
"310",40487580,"Malignant epithelial neoplasm of alveolus dentalis","condition","clinical finding","SNOMED"
"311",40488048,"Malignant neoplasm of alveolus of mandible","condition","clinical finding","SNOMED"
"312",44782582,"Keratinizing squamous cell carcinoma of nasopharynx","condition","clinical finding","SNOMED"
"313",44783846,"Malignant melanoma of vestibule of mouth","condition","clinical finding","SNOMED"
"314",44782589,"Malignant melanoma of tongue","condition","clinical finding","SNOMED"
"315",44783847,"Malignant melanoma of floor of mouth","condition","clinical finding","SNOMED"
"316",44783848,"Malignant melanoma of palatine arch","condition","clinical finding","SNOMED"
"317",44782590,"Malignant melanoma of buccal mucosa","condition","clinical finding","SNOMED"
"318",44783851,"Undifferentiated nonkeratinizing carcinoma of nasopharynx","condition","clinical finding","SNOMED"
"319",44782652,"Malignant melanoma of gum","condition","clinical finding","SNOMED"
"320",45768871,"Primary adenocarcinoma of hypopharynx","condition","clinical finding","SNOMED"
"321",45768872,"Primary oxyphilic adenocarcinoma of oropharynx","condition","clinical finding","SNOMED"
"322",45768873,"Primary basal cell adenocarcinoma of oropharynx","condition","clinical finding","SNOMED"
"323",45768874,"Primary polymorphous low grade adenocarcinoma of oropharynx","condition","clinical finding","SNOMED"
"324",45768875,"Primary papillary adenocarcinoma of oropharynx","condition","clinical finding","SNOMED"
"325",45768876,"Primary mucinous adenocarcinoma of oropharynx","condition","clinical finding","SNOMED"
"326",45768877,"Primary clear cell adenocarcinoma of oropharynx","condition","clinical finding","SNOMED"
"327",45768878,"Primary adenocarcinoma of oropharynx","condition","clinical finding","SNOMED"
"328",45768882,"Primary mucoepidermoid carcinoma of hypopharynx","condition","clinical finding","SNOMED"
"329",45772941,"Primary basaloid squamous cell carcinoma of hypopharynx","condition","clinical finding","SNOMED"
"330",45768942,"Primary papillary squamous cell carcinoma of hypopharynx","condition","clinical finding","SNOMED"
"331",45768943,"Primary undifferentiated carcinoma of hypopharynx","condition","clinical finding","SNOMED"
"332",45768944,"Primary adenoid squamous cell carcinoma of hypopharynx","condition","clinical finding","SNOMED"
"333",45768945,"Primary adenosquamous carcinoma of hypopharynx","condition","clinical finding","SNOMED"
"334",45768946,"Primary basaloid carcinoma of hypopharynx","condition","clinical finding","SNOMED"
"335",45768947,"Primary giant cell carcinoma of hypopharynx","condition","clinical finding","SNOMED"
"336",45768948,"Primary spindle cell squamous cell carcinoma of hypopharynx","condition","clinical finding","SNOMED"
"337",45768949,"Primary verrucous carcinoma of hypopharynx","condition","clinical finding","SNOMED"
"338",45768950,"Primary lymphoepithelial carcinoma of hypopharynx","condition","clinical finding","SNOMED"
"339",45768951,"Primary squamous cell carcinoma of hypopharynx","condition","clinical finding","SNOMED"
"340",45768977,"Primary squamous cell carcinoma of nasopharynx","condition","clinical finding","SNOMED"
"341",45768978,"Overlapping squamous cell carcinoma of oropharynx","condition","clinical finding","SNOMED"
"342",45768980,"Primary squamous cell carcinoma of posterior wall of oropharynx","condition","clinical finding","SNOMED"
"343",45768982,"Primary squamous cell carcinoma of lateral wall of oropharynx","condition","clinical finding","SNOMED"
"344",45768984,"Primary squamous cell carcinoma of anterior surface of epiglottis","condition","clinical finding","SNOMED"
"345",45773564,"Primary squamous cell carcinoma of vallecula","condition","clinical finding","SNOMED"
"346",45768985,"Primary adenoid cystic carcinoma of hypopharynx","condition","clinical finding","SNOMED"
"347",45772951,"Primary basaloid squamous cell carcinoma of oropharynx","condition","clinical finding","SNOMED"
"348",45769021,"Primary basaloid carcinoma of oropharynx","condition","clinical finding","SNOMED"
"349",45769022,"Primary papillary squamous cell carcinoma of oropharynx","condition","clinical finding","SNOMED"
"350",45769023,"Primary spindle cell squamous cell carcinoma of oropharynx","condition","clinical finding","SNOMED"
"351",45769024,"Primary adenosquamous carcinoma of oropharynx","condition","clinical finding","SNOMED"
"352",45769025,"Primary lymphoepithelial carcinoma of oropharynx","condition","clinical finding","SNOMED"
"353",45769026,"Primary squamous cell carcinoma of oropharynx","condition","clinical finding","SNOMED"
"354",45769027,"Primary myoepithelial carcinoma of oropharynx","condition","clinical finding","SNOMED"
"355",45769028,"Primary carcinoma ex pleomorphic adenoma of oropharynx","condition","clinical finding","SNOMED"
"356",45769029,"Primary epithelial-myoepithelial carcinoma of oropharynx","condition","clinical finding","SNOMED"
"357",45771025,"Primary cystadenocarcinoma of oropharynx","condition","clinical finding","SNOMED"
"358",45769030,"Primary acinar cell carcinoma of oropharynx","condition","clinical finding","SNOMED"
"359",45769031,"Primary mucoepidermoid carcinoma of oropharynx","condition","clinical finding","SNOMED"
"360",45769032,"Primary infiltrating duct carcinoma of oropharynx","condition","clinical finding","SNOMED"
"361",45771026,"Primary salivary gland-type tumor of oropharynx","condition","clinical finding","SNOMED"
"362",45769058,"Primary salivary gland type carcinoma of hypopharynx","condition","clinical finding","SNOMED"
"363",45769059,"Overlapping squamous cell carcinoma of hypopharynx","condition","clinical finding","SNOMED"
"364",45769108,"Primary squamous cell carcinoma of posterior wall of hypopharynx","condition","clinical finding","SNOMED"
"365",45771033,"Primary squamous cell carcinoma of hypopharyngeal aspect of aryepiglottic fold","condition","clinical finding","SNOMED"
"366",45769121,"Primary squamous cell carcinoma of postcricoid region","condition","clinical finding","SNOMED"
"367",45769122,"Primary squamous cell carcinoma of pyriform sinus","condition","clinical finding","SNOMED"
"368",45769123,"Nonkeratinizing carcinoma of the nasopharynx","condition","clinical finding","SNOMED"
"369",36715797,"Primary adenocarcinoma of parotid gland","condition","clinical finding","SNOMED"
"370",36715837,"Primary undifferentiated carcinoma of oropharynx","condition","clinical finding","SNOMED"
"371",36716485,"Primary rhabdomyosarcoma of oral cavity","condition","clinical finding","SNOMED"
"372",36716486,"Primary rhabdomyosarcoma of pharynx","condition","clinical finding","SNOMED"
"373",36716502,"Primary squamous cell carcinoma of pharyngeal tonsil","condition","clinical finding","SNOMED"
"374",36716610,"Primary squamous cell carcinoma of base of tongue","condition","clinical finding","SNOMED"
"375",36717352,"Primary squamous cell carcinoma of lingual tonsil","condition","clinical finding","SNOMED"
"376",36717226,"Primary squamous cell carcinoma of parotid gland","condition","clinical finding","SNOMED"
"377",37116583,"Primary squamous cell carcinoma of oral cavity","condition","clinical finding","SNOMED"
"378",37116584,"Primary squamous cell carcinoma of lip","condition","clinical finding","SNOMED"
"379",37117762,"Primary squamous cell carcinoma of pharynx","condition","clinical finding","SNOMED"
"380",42537751,"Primary adenocarcinoma of sublingual gland","condition","clinical finding","SNOMED"
"381",42537752,"Primary adenocarcinoma of submandibular gland","condition","clinical finding","SNOMED"
"382",42537753,"Primary squamous cell carcinoma of submandibular gland","condition","clinical finding","SNOMED"
"383",42539700,"Primary squamous cell carcinoma of sublingual gland","condition","clinical finding","SNOMED"
"384",37018571,"Primary adenoid cystic carcinoma of nasopharynx","condition","clinical finding","SNOMED"
"385",37204489,"Malignant epithelial neoplasm of salivary gland","condition","clinical finding","SNOMED"
"386",3655852,"Papillary squamous cell carcinoma of nasopharynx","condition","clinical finding","SNOMED"
"387",140048,"Malignant melanoma of skin of lip","condition","clinical finding","SNOMED"
"388",4246793,"Primary malignant neoplasm of adenoid","condition","clinical finding","SNOMED"
"389",4246015,"Primary malignant neoplasm of alveolar ridge mucosa","condition","clinical finding","SNOMED"
"390",436643,"Primary malignant neoplasm of anterior aspect of epiglottis","condition","clinical finding","SNOMED"
"391",256633,"Primary malignant neoplasm of base of tongue","condition","clinical finding","SNOMED"
"392",434587,"Primary malignant neoplasm of dorsal surface of tongue","condition","clinical finding","SNOMED"
"393",4311476,"Primary malignant neoplasm of gingival mucosa","condition","clinical finding","SNOMED"
"394",434577,"Primary malignant neoplasm of hypopharyngeal aspect of aryepiglottic fold","condition","clinical finding","SNOMED"
"395",4311479,"Primary malignant neoplasm of hypopharyngeal aspect of interarytenoid fold","condition","clinical finding","SNOMED"
"396",132832,"Primary malignant neoplasm of inner aspect of lip","condition","clinical finding","SNOMED"
"397",137219,"Primary malignant neoplasm of inner aspect of lower lip","condition","clinical finding","SNOMED"
"398",138351,"Primary malignant neoplasm of inner aspect of upper lip","condition","clinical finding","SNOMED"
"399",4247831,"Primary malignant neoplasm of laryngeal surface of epiglottis","condition","clinical finding","SNOMED"
"400",434289,"Primary malignant neoplasm of lingual tonsil","condition","clinical finding","SNOMED"
"401",4247836,"Primary malignant neoplasm of major salivary gland","condition","clinical finding","SNOMED"
"402",436922,"Primary malignant neoplasm of postcricoid region","condition","clinical finding","SNOMED"
"403",435474,"Primary malignant neoplasm of posterior hypopharyngeal wall","condition","clinical finding","SNOMED"
"404",435190,"Primary malignant neoplasm of pyriform sinus","condition","clinical finding","SNOMED"
"405",433704,"Primary malignant neoplasm of retromolar area","condition","clinical finding","SNOMED"
"406",136915,"Primary malignant neoplasm of skin of lip","condition","clinical finding","SNOMED"
"407",254282,"Primary malignant neoplasm of soft palate","condition","clinical finding","SNOMED"
"408",439738,"Primary malignant neoplasm of sublingual gland","condition","clinical finding","SNOMED"
"409",4312691,"Primary malignant neoplasm of submaxillary gland","condition","clinical finding","SNOMED"
"410",437498,"Primary malignant neoplasm of tongue","condition","clinical finding","SNOMED"
"411",433709,"Primary malignant neoplasm of tonsillar fossa","condition","clinical finding","SNOMED"
"412",434285,"Primary malignant neoplasm of uvula","condition","clinical finding","SNOMED"
"413",438360,"Primary malignant neoplasm of vallecula","condition","clinical finding","SNOMED"
"414",437220,"Primary malignant neoplasm of ventral surface of tongue","condition","clinical finding","SNOMED"
"415",133969,"Primary malignant neoplasm of vermilion border of lip","condition","clinical finding","SNOMED"
"416",432254,"Primary malignant neoplasm of Waldeyer's ring","condition","clinical finding","SNOMED"
"417",4111775,"Carcinoma of hard palate","condition","clinical finding","SNOMED"
"418",438694,"Primary malignant neoplasm of hard palate","condition","clinical finding","SNOMED"
"419",4246138,"Primary malignant neoplasm of palatine bone","condition","clinical finding","SNOMED"
"420",140958,"Kaposi's sarcoma of palate","condition","clinical finding","SNOMED"
"421",4001170,"Overlapping malignant neoplasm of palate","condition","clinical finding","SNOMED"
"422",4089644,"Malignant neoplasm of junction of hard and soft palate","condition","clinical finding","SNOMED"
"423",4166769,"Palate carcinoma","condition","clinical finding","SNOMED"
"424",134290,"Primary malignant neoplasm of palate","condition","clinical finding","SNOMED"
"425",44784246,"Malignant melanoma of palate","condition","clinical finding","SNOMED"
"426",36715796,"Primary adenocarcinoma of palate","condition","clinical finding","SNOMED"
"427",36684449,"High grade astrocytoma of brain","condition","clinical finding","SNOMED"
"428",36684450,"Low grade astrocytoma of brain","condition","clinical finding","SNOMED"
"429",36684451,"Oligodendroglioma of cerebrum","condition","clinical finding","SNOMED"
"430",759902,"Oligodendroglioma of brain stem","condition","clinical finding","SNOMED"
"431",37016118,"Astrocytoma of brain stem","condition","clinical finding","SNOMED"
"432",36712712,"Primary basal cell carcinoma of left ear","condition","clinical finding","SNOMED"
"433",36712713,"Primary basal cell carcinoma of left eyelid","condition","clinical finding","SNOMED"
"434",36712714,"Primary basal cell carcinoma of right ear","condition","clinical finding","SNOMED"
"435",36712715,"Primary basal cell carcinoma of right eyelid","condition","clinical finding","SNOMED"
"436",36712731,"Malignant melanoma of left choroid","condition","clinical finding","SNOMED"
"437",36712732,"Malignant melanoma of right choroid","condition","clinical finding","SNOMED"
"438",36712744,"Primary squamous cell carcinoma of left ear","condition","clinical finding","SNOMED"
"439",36712746,"Primary squamous cell carcinoma of right ear","condition","clinical finding","SNOMED"
"440",35610168,"Malignant neoplasm of nose","condition","clinical finding","SNOMED"
"441",35610243,"Malignant neoplasm of jaw","condition","clinical finding","SNOMED"
"442",35610246,"Malignant neoplasm of supraclavicular fossa","condition","clinical finding","SNOMED"
"443",253977,"Overlapping malignant neoplasm of accessory sinuses","condition","clinical finding","SNOMED"
"444",22839,"Overlapping malignant neoplasm of larynx","condition","clinical finding","SNOMED"
"445",436352,"Primary malignant neoplasm of laryngeal cartilage","condition","clinical finding","SNOMED"
"446",4003674,"Primary malignant neoplasm of branchial cleft","condition","clinical finding","SNOMED"
"447",4003693,"Overlapping malignant neoplasm of brain","condition","clinical finding","SNOMED"
"448",4003694,"Primary malignant neoplasm of peripheral nerve of head, face AND/OR neck","condition","clinical finding","SNOMED"
"449",4002345,"Primary malignant neoplasm of peripheral nerves of head","condition","clinical finding","SNOMED"
"450",4003173,"Primary malignant neoplasm of peripheral nerves of face","condition","clinical finding","SNOMED"
"451",4001318,"Primary malignant neoplasm of peripheral nerves of neck","condition","clinical finding","SNOMED"
"452",438095,"Overlapping malignant neoplasm of eye and adnexa (primary)","condition","clinical finding","SNOMED"
"453",3656333,"Diffuse intrinsic pontine glioma","condition","clinical finding","SNOMED"
"454",4045412,"Orbital lymphoma","condition","clinical finding","SNOMED"
"455",36684467,"Merkel cell carcinoma of face","condition","clinical finding","SNOMED"
"456",761019,"Merkel cell carcinoma of neck","condition","clinical finding","SNOMED"
"457",761020,"Merkel cell carcinoma of scalp","condition","clinical finding","SNOMED"
"458",4046873,"Odontogenic ghost cell carcinoma","condition","clinical finding","SNOMED"
"459",761863,"Angiosarcoma of skin of cheek","condition","clinical finding","SNOMED"
"460",761906,"Primary adenocarcinoma of lacrimal gland","condition","clinical finding","SNOMED"
"461",4091932,"Malignant neoplasm of epiglottis, free border","condition","clinical finding","SNOMED"
"462",4095309,"Malignant neoplasm of glossoepiglottic fold","condition","clinical finding","SNOMED"
"463",4089646,"Malignant neoplasm of junctional region of epiglottis","condition","clinical finding","SNOMED"
"464",4092058,"Malignant tumor of opening of auditory tube","condition","clinical finding","SNOMED"
"465",4094854,"Malignant tumor of cervical part of esophagus","condition","clinical finding","SNOMED"
"466",4094870,"Malignant neoplasm of cartilage of nose","condition","clinical finding","SNOMED"
"467",4092209,"Malignant neoplasm of nasal conchae","condition","clinical finding","SNOMED"
"468",4092210,"Malignant tumor of nasal vestibule","condition","clinical finding","SNOMED"
"469",377229,"Malignant neoplasm of auditory tube, middle ear and mastoid air cells","condition","clinical finding","SNOMED"
"470",4089671,"Malignant tumor of Eustachian tube","condition","clinical finding","SNOMED"
"471",4094871,"Malignant tumor of tympanic cavity","condition","clinical finding","SNOMED"
"472",4095443,"Malignant tumor of tympanic antrum","condition","clinical finding","SNOMED"
"473",4092211,"Malignant tumor of glottis","condition","clinical finding","SNOMED"
"474",4092212,"Malignant tumor of supraglottis","condition","clinical finding","SNOMED"
"475",4092213,"Malignant neoplasm of arytenoid cartilage","condition","clinical finding","SNOMED"
"476",4095446,"Malignant neoplasm of cricoid cartilage","condition","clinical finding","SNOMED"
"477",4092214,"Malignant neoplasm of cuneiform cartilage","condition","clinical finding","SNOMED"
"478",258084,"Malignant neoplasm of bones of skull and face","condition","clinical finding","SNOMED"
"479",4089761,"Malignant neoplasm of malar bone","condition","clinical finding","SNOMED"
"480",4092223,"Malignant neoplasm of orbital bone","condition","clinical finding","SNOMED"
"481",4095455,"Malignant neoplasm of cervical vertebra","condition","clinical finding","SNOMED"
"482",4095008,"Malignant neoplasm of cartilage of ear","condition","clinical finding","SNOMED"
"483",4089774,"Malignant neoplasm of tarsus of eyelid","condition","clinical finding","SNOMED"
"484",4089775,"Malignant neoplasm soft tissues of cervical spine","condition","clinical finding","SNOMED"
"485",4095589,"Malignant melanoma of ear and/or external auditory canal","condition","clinical finding","SNOMED"
"486",4092364,"Malignant melanoma of auricle (ear)","condition","clinical finding","SNOMED"
"487",4089861,"Malignant melanoma of external auditory meatus","condition","clinical finding","SNOMED"
"488",4092366,"Malignant melanoma of chin","condition","clinical finding","SNOMED"
"489",4095590,"Malignant melanoma of forehead","condition","clinical finding","SNOMED"
"490",4095591,"Malignant melanoma of temple","condition","clinical finding","SNOMED"
"491",4095592,"Malignant melanoma of scalp and/or neck","condition","clinical finding","SNOMED"
"492",4095142,"Malignant melanoma of scalp","condition","clinical finding","SNOMED"
"493",4095593,"Malignant melanoma of neck","condition","clinical finding","SNOMED"
"494",4095598,"Malignant neoplasm of skin of ear and external auditory canal","condition","clinical finding","SNOMED"
"495",4095148,"Malignant neoplasm of skin of auricle (ear)","condition","clinical finding","SNOMED"
"496",4092379,"Malignant neoplasm of skin of external auditory meatus","condition","clinical finding","SNOMED"
"497",4091333,"Malignant neoplasm of skin of cheek, external","condition","clinical finding","SNOMED"
"498",4092380,"Malignant neoplasm of skin of nose (external)","condition","clinical finding","SNOMED"
"499",4092381,"Malignant neoplasm of skin of temple","condition","clinical finding","SNOMED"
"500",4092382,"Malignant neoplasm of scalp and/or skin of neck","condition","clinical finding","SNOMED"
"501",439302,"Malignant neoplasm of scalp","condition","clinical finding","SNOMED"
"502",374297,"Malignant neoplasm of eyeball excluding conjunctiva, cornea, retina and choroid","condition","clinical finding","SNOMED"
"503",4095294,"Malignant tumor of ciliary body","condition","clinical finding","SNOMED"
"504",4095762,"Malignant tumor of iris","condition","clinical finding","SNOMED"
"505",4095295,"Malignant neoplasm of crystalline lens","condition","clinical finding","SNOMED"
"506",4095763,"Malignant neoplasm of sclera","condition","clinical finding","SNOMED"
